{
  "schema_version": 1,
  "module_id": "model.ollama",
  "display_name": "Ollama Model Manager",
  "description": "Manages consent, installation state and background downloads for local Ollama models.",
  "module_version": "0.2.0",
  "core_api": "1",
  "capabilities": ["model.local.ensure", "model.local.status", "model.catalog.read", "model.catalog.respond"],
  "dependencies": [],
  "optional_dependencies": [],
  "requested_permissions": ["model.download-network", "model.manage-process"],
  "lifecycle": "background",
  "resource_class": "light",
  "default_enabled": true,
  "entrypoint": {"kind": "python-service", "module": "ai_native_model_ollama", "python_path": "src"}
}
