{
  "schema_version": 1,
  "module_id": "provider.ollama",
  "display_name": "Ollama Provider",
  "description": "Installs and manages a verified user-local Ollama runtime without root privileges.",
  "module_version": "0.2.0",
  "core_api": "1",
  "capabilities": ["provider.ollama.status", "provider.ollama.respond"],
  "dependencies": [],
  "optional_dependencies": [],
  "requested_permissions": ["provider.download-network", "provider.install-user-local", "provider.manage-process"],
  "lifecycle": "background",
  "resource_class": "light",
  "default_enabled": true,
  "entrypoint": {"kind": "python-service", "module": "ai_native_provider_ollama", "python_path": "src"}
}
